message_id,timestamp,datetime,user_name,user_id,text,attachments,likes,group_id,source
169730140440165934,1697301404,2023-10-14T11:36:44,Keller “Lemon Man” White,63896632,Room 306,0,4,52459104,unknown
169716155780440372,1697161557,2023-10-12T20:45:57,Keller “Lemon Man” White,63896632,If we seduce every single swimmer on the other teams then none of them will be able to make it to the pool the next day and we will win easily,0,19,52459104,unknown
169713221512399429,1697132215,2023-10-12T12:36:55,Keller “Lemon Man” White,63896632,"We’ve been invited to a Halloween mixer with a ton of other GT club sports. They want an attendance list as well as a headcount of how many people are drinking, so please fill out the poll by NEXT TUESDAY if you plan on going. You’ll also have to pay the 5 dollars in advance if you plan on drinking. We’re not hosting so I’m really not sure what to expect, but as always please be respectful of the hosts.",0,3,52459104,unknown
169713201607399429,1697132016,2023-10-12T12:33:36,Keller “Lemon Man” White,63896632,Created new poll 'Are you going to the Halloween Mixer?',1,0,52459104,unknown
169713194862570030,1697131948,2023-10-12T12:32:28,Keller “Lemon Man” White,63896632,Keller “Lemon Man” White created event 'Halloween Mixer' https://group.me/4uF94hywETDVPu,1,0,52459104,unknown
169652555462289273,1696525554,2023-10-05T12:05:54,Keller “Lemon Man” White,63896632,Come to trivia or you are getting locked inside big dumpy at the next tailgate ,0,5,52459104,unknown
169652183979281946,1696521839,2023-10-05T11:03:59,Keller “Lemon Man” White,63896632,Keller “Lemon Man” White created event 'trivia pregame' https://group.me/1oD9zh6OUPwpzk,1,0,52459104,unknown
169600764157876931,1696007641,2023-09-29T12:14:01,Keller “Lemon Man” White,63896632,No,0,3,52459104,unknown
169600742831616071,1696007428,2023-09-29T12:10:28,Keller “Lemon Man” White,63896632,DM me if you need a new fake id. The order is going out tonight,0,1,52459104,unknown
169599869069591344,1695998690,2023-09-29T09:44:50,Keller “Lemon Man” White,63896632,"Just to clarify, the 35 dollar tailgate package only covers tailgates, you still need to pay at parties if you bought it",0,5,52459104,unknown
169599838096278899,1695998380,2023-09-29T09:39:40,Keller “Lemon Man” White,63896632,A grand total of 17 swim club members paid slush last night. There were way more than that drinking. Please pay slush or we will not be able to keep hacking parties.,1,7,52459104,unknown
169592622474880519,1695926224,2023-09-28T13:37:04,Keller “Lemon Man” White,63896632,I will give a free natty light to everyone who signs up (with payment of slush fund),0,4,52459104,unknown
169535388310330519,1695353883,2023-09-21T22:38:03,Keller “Lemon Man” White,63896632,Keller “Lemon Man” White created event 'Water Sports Mixer' https://group.me/drDMDYXKd3Fmo,1,0,52459104,unknown
169496944815614750,1694969448,2023-09-17T11:50:48,Keller “Lemon Man” White,63896632,Oops I fucked it up,0,10,52459104,unknown
169496942112406509,1694969421,2023-09-17T11:50:21,Keller “Lemon Man” White,63896632, Happy Birthday @Thomas Rimsa ,2,20,52459104,unknown
169463387476773249,1694633874,2023-09-13T14:37:54,Keller “Lemon Man” White,63896632,Condom not usb,0,2,52459104,unknown
169463386324643752,1694633863,2023-09-13T14:37:43,Keller “Lemon Man” White,63896632,I have one ,0,0,52459104,unknown
169453672176565797,1694536721,2023-09-12T11:38:41,Keller “Lemon Man” White,63896632,"If anyone is on sailing, jet ski club or another water sport can you send me your social director’s contact so we can plan a mixer",0,0,52459104,unknown
169426968455523752,1694269684,2023-09-09T09:28:04,Keller “Lemon Man” White,63896632,It is black out today,1,2,52459104,unknown
169426496988971756,1694264969,2023-09-09T08:09:29,Keller “Lemon Man” White,63896632,Study abroad people you are required to zoom call the tailgate ,0,6,52459104,unknown
169422819018417373,1694228190,2023-09-08T21:56:30,Keller “Lemon Man” White,63896632,,1,0,52459104,unknown
169422818337437373,1694228183,2023-09-08T21:56:23,Keller “Lemon Man” White,63896632,If you don’t I will go broke and there will be no more parties,0,2,52459104,unknown
169422816832234039,1694228168,2023-09-08T21:56:08,Keller “Lemon Man” White,63896632,If you are drinking please Venmo me @James-White-1580,0,2,52459104,unknown
169422508196832431,1694225081,2023-09-08T21:04:41,Keller “Lemon Man” White,63896632,Stack cup outside,0,0,52459104,unknown
169422027304193752,1694220273,2023-09-08T19:44:33,Keller “Lemon Man” White,63896632,What the actual fuck justin this is a public groupchat,0,6,52459104,unknown
169421145654592431,1694211456,2023-09-08T17:17:36,Keller “Lemon Man” White,63896632,Follow your heart,0,1,52459104,unknown
169420907492056627,1694209074,2023-09-08T16:37:54,Keller “Lemon Man” White,63896632,One of the people living in the house has an important test tomorrow morning and needs to sleep,0,1,52459104,unknown
169420883861603752,1694208838,2023-09-08T16:33:58,Keller “Lemon Man” White,63896632,"Quick reminder that we do have to be out by 11:45 this time, so make sure to show up early",1,1,52459104,unknown
169410001733729778,1694100017,2023-09-07T10:20:17,Keller “Lemon Man” White,63896632,Keller “Lemon Man” White created event 'Trivia Pregame' https://group.me/5RwxrLPk0Oh6BA,1,0,52459104,unknown
169379327307566465,1693793273,2023-09-03T21:07:53,Keller “Lemon Man” White,63896632,Also make sure you rsvp to the event so we know how much alcohol to buy. There will be swim clubs signature punch and a keg.,0,0,52459104,unknown
169379324082750648,1693793240,2023-09-03T21:07:20,Keller “Lemon Man” White,63896632,"Less than one week until the first party of the year! We want to reach unfathomable levels of degeneracy this year, and we need you to help (or don’t, everything is optional). All new members are welcome, so feel free to invite people or just add them in the groupchat.",1,8,52459104,unknown
169358542385156535,1693585423,2023-09-01T11:23:43,Keller “Lemon Man” White,63896632,Give me his coordinates ,0,0,52459104,unknown
169358246611839778,1693582466,2023-09-01T10:34:26,Keller “Lemon Man” White,63896632,I will personally fight circle any member of fake gtsc ,0,2,52459104,unknown
169352454245216596,1693524542,2023-08-31T18:29:02,Keller “Lemon Man” White,63896632,We’re coming,0,0,52459104,unknown
169352409940860648,1693524099,2023-08-31T18:21:39,Keller “Lemon Man” White,63896632,It’s where the bus pickup is,0,0,52459104,unknown
169352319561201535,1693523195,2023-08-31T18:06:35,Keller “Lemon Man” White,63896632,Or if you need a ride,0,0,52459104,unknown
169352319001304983,1693523190,2023-08-31T18:06:30,Keller “Lemon Man” White,63896632,If you are driving remember to meet in the Nav Circle at 7:30 so we can get everyone ,0,0,52459104,unknown
169351699178596535,1693516991,2023-08-31T16:23:11,Keller “Lemon Man” White,63896632,"Trivia pregame is at 6:30 in Nav South (the farthest building from campus) room 424. Try to follow someone in, if you can’t contact me or @Audrey “picnic table” Holshouser ",1,0,52459104,unknown
169344858265404983,1693448582,2023-08-30T21:23:02,Keller “Lemon Man” White,63896632,Remember to rsvp to the trivia event if you’re going and want a ride,0,1,52459104,unknown
169344855148447065,1693448551,2023-08-30T21:22:31,Keller “Lemon Man” White,63896632,Keller “Lemon Man” White created event 'Trivia Pregame' https://group.me/4k2Dg91BXh34gy,1,0,52459104,unknown
169342507208604983,1693425072,2023-08-30T14:51:12,Keller “Lemon Man” White,63896632,"If you want to pay the tailgate fund now send it to this Venmo and title it Tailgate fund. If not, there will also be Venmo sheets at every tailgate.",1,2,52459104,unknown
169341729849596535,1693417298,2023-08-30T12:41:38,Keller “Lemon Man” White,63896632,"PLEASE READ
Important Slush Fund Information:

As many of you know, swim club parties and tailgates operate on a slush fund. You pay in money, we use it to buy alcohol for social events. If you want to drink, PLEASE pay into the fund; it’s not that much and if you don’t your teammates will be fronting the cost. We pay through Venmo, which I would recommend setting up as its the most common payment app at GT.

Tailgates and parties will be 5-10 dollars each which will cover beer and some form of jungle juice. Alternatively for tailgates, you can pay 35 dollars to cover alcohol at all 7 tailgates (the cheaper option if you’re going to most/all of them) We typically buy beer for tailgates. Seltzers are more expensive, so if there’s enough interest we’ll have a separate fund (We’ll keep the seltzers separate so only people who paid for them can drink them).

Try not to bring huge crowds, but close friends of swim club are welcome at tailgates as long as they pay into slush.",0,13,52459104,unknown
169317447911111535,1693174479,2023-08-27T17:14:39,Keller “Lemon Man” White,63896632,Add new members to this groupchat if you’ve met them and they paid dues,0,0,52459104,unknown
169239373782979093,1692393737,2023-08-18T16:22:17,Keller “Lemon Man” White,63896632,"If you want to help out with planning or setting up for parties and other social events, join the social committee",0,0,52459104,unknown
169239368735065564,1692393687,2023-08-18T16:21:27,Keller “Lemon Man” White,63896632,You're invited to my new group 'GTSC Social Committee' on GroupMe. Click here to join: https://groupme.com/join_group/95750403/muQITreW,0,0,52459104,unknown
169222832022674306,1692228320,2023-08-16T18:25:20,Keller “Lemon Man” White,63896632,Keller “Lemon Man” White created event 'GTSC Field Day / Recruitment Event' https://group.me/40NTKQAmEtATd5,1,0,52459104,unknown
169202641516969015,1692026415,2023-08-14T10:20:15,Keller “Lemon Man” White,63896632,"Hello everyone, it’s time to recruit the next generation of degenerates! If enough people are available, we want to have a chance to meet the pnms before practices start. If you can’t make it no worries (I know it conflicts with rush and move in for a lot of people), there will be more social/recruitment events in the coming weeks.",0,8,52459104,unknown
169202638625234496,1692026386,2023-08-14T10:19:46,Keller “Lemon Man” White,63896632,Created new poll 'Will you be available this Saturday (8/19) for a GTSC recruitment event?',1,0,52459104,unknown
168638151145152087,1686381511,2023-06-10T02:18:31,Keller “Lemon Man” White,63896632,,1,7,52459104,unknown
168274017636652210,1682740176,2023-04-28T22:49:36,Keller “Lemon Man” White,63896632,-blackout keller,0,1,52459104,unknown
168274016682280792,1682740166,2023-04-28T22:49:26,Keller “Lemon Man” White,63896632,If you do not blackout Keller will come for you,0,2,52459104,unknown
168274014934380539,1682740149,2023-04-28T22:49:09,Keller “Lemon Man” White,63896632,If you drank beer tonight please remember to Venmo  - https://venmo.com/u/James-White-1580,0,0,52459104,unknown
168272821666464458,1682728216,2023-04-28T19:30:16,Keller “Lemon Man” White,63896632,There’s a die table at postgame if anyone can bring dice,0,0,52459104,unknown
168253399739545424,1682533997,2023-04-26T13:33:17,Keller “Lemon Man” White,63896632,Not really we are all very focused,0,3,52459104,unknown
168253377630382122,1682533776,2023-04-26T13:29:36,Keller “Lemon Man” White,63896632,Come to study room so I can distract you from studying,0,1,52459104,unknown
168227500017667726,1682275000,2023-04-23T13:36:40,Keller “Lemon Man” White,63896632,I don’t wanna harass but please remember to pay if you drank last night so we can continue supplying abundant alcohol at swim club events (Thank you to everyone who did pay),1,17,52459104,unknown
168226971520890508,1682269715,2023-04-23T12:08:35,Keller “Lemon Man” White,63896632,,1,21,52459104,unknown
168221759525687726,1682217595,2023-04-22T21:39:55,Keller “Lemon Man” White,63896632,"If you are drinking beer, punch, or seltzer please remember to pay",0,2,52459104,unknown
168221494559010168,1682214945,2023-04-22T20:55:45,Keller “Lemon Man” White,63896632,If you drunk tonight please Venmo me @James-White-1580 so I don’t go broke,0,2,52459104,unknown
168221492201042580,1682214922,2023-04-22T20:55:22,Keller “Lemon Man” White,63896632,https://venmo.com/u/James-White-1580,0,0,52459104,unknown
168221106248756446,1682211062,2023-04-22T19:51:02,Keller “Lemon Man” White,63896632,Come at 10 btw,0,2,52459104,unknown
168220939808105513,1682209398,2023-04-22T19:23:18,Keller “Lemon Man” White,63896632,"Pull up to lambda later for the postgame! We’ll have pong tables and will provide some beer and swim club punch (make sure you Venmo if you drink), but if you want to drink heavily it might be best to bring your own supply",0,6,52459104,unknown
168212946971860508,1682129469,2023-04-21T21:11:09,Keller “Lemon Man” White,63896632,There will be week old swim club punch there get hyped,0,2,52459104,unknown
168212944256907726,1682129442,2023-04-21T21:10:42,Keller “Lemon Man” White,63896632,I’m so fucking excited for event name,0,11,52459104,unknown
168165168895764062,1681651688,2023-04-16T08:28:08,Keller “Lemon Man” White,63896632,Text Audrey or me for rides,0,0,52459104,unknown
168165164474168810,1681651644,2023-04-16T08:27:24,Keller “Lemon Man” White,63896632,Also big thanks to Curran for hosting. If you are up and not too hungover please considering coming to Curran at 11 to help clean up,0,9,52459104,unknown
168165160321296156,1681651603,2023-04-16T08:26:43,Keller “Lemon Man” White,63896632,Shoutout to @Gabriel Montes and @cole for sober monitoring last night,1,13,52459104,unknown
168161284393207152,1681612843,2023-04-15T21:40:43,Keller “Lemon Man” White,63896632,No fuck Thomas and Micheal do not pay them,0,1,52459104,unknown
168161123407803291,1681611234,2023-04-15T21:13:54,Keller “Lemon Man” White,63896632,If you are drinking please Venmo @AudreyHols. We can only have these parties if people pay into slush fund,0,1,52459104,unknown
168160723493804062,1681607234,2023-04-15T20:07:14,Keller “Lemon Man” White,63896632,Knock on the door when you get here and we’ll let you in. Keeping the door closed for now for privacy reasons ,0,0,52459104,unknown
168160679229700782,1681606792,2023-04-15T19:59:52,Keller “Lemon Man” White,63896632,Don’t let her down,0,2,52459104,unknown
168160678845756071,1681606788,2023-04-15T19:59:48,Keller “Lemon Man” White,63896632,Erin’s birthday wish is for everyone to black out tonight,0,5,52459104,unknown
168109181313911164,1681091813,2023-04-09T20:56:53,Keller “Lemon Man” White,63896632,Keller “Lemon Man” White created event 'Post Nattys Rager (Drink Swim Club Dry)' https://group.me/3clYo9bi9URvQU,1,2,52459104,unknown
168092787682085623,1680927876,2023-04-07T23:24:36,Keller “Lemon Man” White,63896632,Mia is short,0,4,52459104,unknown
168092482334261164,1680924823,2023-04-07T22:33:43,Keller “Lemon Man” White,63896632,You are all high ,0,2,52459104,unknown
168092481765201164,1680924817,2023-04-07T22:33:37,Keller “Lemon Man” White,63896632,It’s just a smudge on the lens,0,0,52459104,unknown
168092479777796448,1680924797,2023-04-07T22:33:17,Keller “Lemon Man” White,63896632,That’s not me,0,0,52459104,unknown
168083989539247156,1680839895,2023-04-06T22:58:15,Keller “Lemon Man” White,63896632,Clearly veranda in the background Audrey is a liar and a thief ,0,3,52459104,unknown
168083987129024827,1680839871,2023-04-06T22:57:51,Keller “Lemon Man” White,63896632,,1,9,52459104,unknown
168083978892644827,1680839788,2023-04-06T22:56:28,Keller “Lemon Man” White,63896632,Vansh is pounding down shot after shot,0,2,52459104,unknown
168083977464664827,1680839774,2023-04-06T22:56:14,Keller “Lemon Man” White,63896632,Veranda is popping rn,0,0,52459104,unknown
167962261937004311,1679622619,2023-03-23T20:50:19,Keller “Lemon Man” White,63896632,Taco Bell,1,0,52459104,unknown
167872301084017180,1678723010,2023-03-13T10:56:50,Keller “Lemon Man” White,63896632,,1,5,52459104,unknown
167865114547534932,1678651145,2023-03-12T14:59:05,Keller “Lemon Man” White,63896632,Vote Audrey and Keller for social chair,1,18,52459104,unknown
167859230974533398,1678592309,2023-03-11T21:38:29,Keller “Lemon Man” White,63896632,Come to veranda or a very belligerent Keller and George will be coming for you,0,1,52459104,unknown
167854722877149229,1678547228,2023-03-11T09:07:08,Keller “Lemon Man” White,63896632,Pull up or a very belligerent George may be coming for you,0,4,52459104,unknown
167854362787952643,1678543627,2023-03-11T08:07:07,Keller “Lemon Man” White,63896632,Remember to put in and order for 11:30 and send the pickup code to Trina if you want Jimmy Johns.,0,1,52459104,unknown
167823891218317198,1678238912,2023-03-07T19:28:32,Keller “Lemon Man” White,63896632,I will never be caught in a pool,0,3,52459104,unknown
167823890135177409,1678238901,2023-03-07T19:28:21,Keller “Lemon Man” White,63896632,That’s not me,0,2,52459104,unknown
167799215477769855,1677992154,2023-03-04T22:55:54,Keller “Lemon Man” White,63896632,,1,3,52459104,unknown
167799209704774683,1677992097,2023-03-04T22:54:57,Keller “Lemon Man” White,63896632,No I’m not ,0,0,52459104,unknown
167739145450163114,1677391454,2023-02-26T00:04:14,Keller “Lemon Man” White,63896632,L + ratio,0,5,52459104,unknown
167739144958137272,1677391449,2023-02-26T00:04:09,Keller “Lemon Man” White,63896632,That’s not what the poll said,0,1,52459104,unknown
167739134119331762,1677391341,2023-02-26T00:02:21,Keller “Lemon Man” White,63896632,,1,4,52459104,unknown
167739095172341762,1677390951,2023-02-25T23:55:51,Keller “Lemon Man” White,63896632,,1,2,52459104,unknown
167739056672719790,1677390566,2023-02-25T23:49:26,Keller “Lemon Man” White,63896632,This is why you are no longer the coach ,1,5,52459104,unknown
167738385356199790,1677383853,2023-02-25T21:57:33,Keller “Lemon Man” White,63896632,Dislike,1,8,52459104,unknown
167738378454179136,1677383784,2023-02-25T21:56:24,Keller “Lemon Man” White,63896632,You are wrong,0,5,52459104,unknown
167738378218657272,1677383782,2023-02-25T21:56:22,Keller “Lemon Man” White,63896632,She did,0,2,52459104,unknown
167738321739669136,1677383217,2023-02-25T21:46:57,Keller “Lemon Man” White,63896632,,1,7,52459104,unknown
167737938099211762,1677379380,2023-02-25T20:43:00,Keller “Lemon Man” White,63896632,Created new poll 'Replace Natalie as coach with Keller?',1,2,52459104,unknown
167737790018690585,1677377900,2023-02-25T20:18:20,Keller “Lemon Man” White,63896632,Must not be Natalie ,0,0,52459104,unknown
167720874735137173,1677208747,2023-02-23T21:19:07,Keller “Lemon Man” White,63896632,Come to Veranda Mathias is making a guest appearance,0,5,52459104,unknown
167719878408857173,1677198784,2023-02-23T18:33:04,Keller “Lemon Man” White,63896632,Yes,0,1,52459104,unknown
167712796227460603,1677127962,2023-02-22T22:52:42,Keller “Lemon Man” White,63896632,Me and the homies on the drive to Mike’s mom’s house,1,6,52459104,unknown
167712735256081857,1677127352,2023-02-22T22:42:32,Keller “Lemon Man” White,63896632,Fun fact: that is Mike’s actual mom,0,7,52459104,unknown
167712723779520338,1677127237,2023-02-22T22:40:37,Keller “Lemon Man” White,63896632,Mike’s mom’s house for water polo tomorrow ,1,4,52459104,unknown
167712675692547981,1677126756,2023-02-22T22:32:36,Keller “Lemon Man” White,63896632,https://v.groupme.com/52459104/2023-02-23T04:32:26Z/55509638.360x640r0.mp4,1,14,52459104,unknown
167712646497819836,1677126464,2023-02-22T22:27:44,Keller “Lemon Man” White,63896632,What about Air polo,0,1,52459104,unknown
167712622475943194,1677126224,2023-02-22T22:23:44,Keller “Lemon Man” White,63896632,Common Angela L,0,2,52459104,unknown
167695505229935427,1676955052,2023-02-20T22:50:52,Keller “Lemon Man” White,63896632,Blackout me ruins sober me’s day once again,1,4,52459104,unknown
167670153584500338,1676701535,2023-02-18T00:25:35,Keller “Lemon Man” White,63896632,Old,0,7,52459104,unknown
167554164159715310,1675541641,2023-02-04T14:14:01,Keller “Lemon Man” White,63896632,Is anyone getting alcohol before tonight?,0,1,52459104,unknown
167371706982135089,1673717069,2023-01-14T11:24:29,Keller “Lemon Man” White,63896632,First person to black out at or before a gt sporting event this semester gets a prize!,0,5,52459104,unknown
167371703431531850,1673717034,2023-01-14T11:23:54,Keller “Lemon Man” White,63896632,Basketball pregame starts in less than an hour. I recommend showing up at the start so you have more time to drink.,0,3,52459104,unknown
167357791480151850,1673577914,2023-01-12T20:45:14,Keller “Lemon Man” White,63896632,Use the name “Wet Bandits” so they know it’s the same people each week,0,2,52459104,unknown
167354917072810417,1673549170,2023-01-12T12:46:10,Keller “Lemon Man” White,63896632,"We can’t ice skate tonight because of weather, so we’re doing trivia at Rays Pizza instead.",0,3,52459104,unknown
167354905844991981,1673549058,2023-01-12T12:44:18,Keller “Lemon Man” White,63896632,Keller “Lemon Man” White created event 'Trivia' https://group.me/2FxCilMX81NRjg,1,0,52459104,unknown
167347004471572979,1673470044,2023-01-11T14:47:24,Keller “Lemon Man” White,63896632,Keller “Lemon Man” White created event 'Basketball pregame' https://group.me/5vAQMYwrYaZ8kx,1,2,52459104,unknown
167226160996754451,1672261609,2022-12-28T15:06:49,Keller “Lemon Man” White,63896632,Keller “Lemon Man” White created event 'New Years Party' https://group.me/1OBS6SwilijKaD,1,1,52459104,unknown
167199450596315855,1671994505,2022-12-25T12:55:05,Keller “Lemon Man” White,63896632,Created new poll 'Will you be in Atlanta for New Years Eve and interested in doing something?',1,1,52459104,unknown
167088721847386147,1670887218,2022-12-12T17:20:18,Keller “Lemon Man” White,63896632,Created new poll 'Who is who?',1,0,52459104,unknown
167088718279322273,1670887182,2022-12-12T17:19:42,Keller “Lemon Man” White,63896632,,1,0,52459104,unknown
167088221024193418,1670882210,2022-12-12T15:56:50,Keller “Lemon Man” White,63896632,Who owns these hoodies they were both left at Kendeda on Saturday ,1,0,52459104,unknown
167018868838346241,1670188688,2022-12-04T15:18:08,Keller “Lemon Man” White,63896632,Yeah I’m great,0,3,52459104,unknown
166986501416501512,1669865014,2022-11-30T21:23:34,Keller “Lemon Man” White,63896632,Are you saying you’ve never been fingered by a margarita before?,0,0,52459104,unknown
166974475922411650,1669744759,2022-11-29T11:59:19,Keller “Lemon Man” White,63896632,Is the beer mile a valid excuse to reschedule a final?,0,14,52459104,unknown
166906981017929476,1669069810,2022-11-21T16:30:10,Keller “Lemon Man” White,63896632,Is Cypress strict on fakes?,0,0,52459104,unknown
166890732102616885,1668907321,2022-11-19T19:22:01,Keller “Lemon Man” White,63896632,Industrial waste ,0,2,52459104,unknown
166883022672170940,1668830226,2022-11-18T21:57:06,Keller “Lemon Man” White,63896632,Nvm 11:15,0,0,52459104,unknown
166882960533930940,1668829605,2022-11-18T21:46:45,Keller “Lemon Man” White,63896632,Also chips will be counted at 11. Winner gets a handle,0,0,52459104,unknown
166882958712249550,1668829587,2022-11-18T21:46:27,Keller “Lemon Man” White,63896632,Quick reminder to please pay for your entry/drinks if you haven’t. I know it’s kind of chaotic and easy to slip past without venmoing but this is a fundraiser and all of the money will go towards helping swim club.,0,4,52459104,unknown
166792447170475879,1667924471,2022-11-08T10:21:11,Keller “Lemon Man” White,63896632,I took online history of jazz this summer and the entire class was three tests that had all the answers on google and a short essay.,0,2,52459104,unknown
166639429253770506,1666394292,2022-10-21T18:18:12,Keller “Lemon Man” White,63896632,Who’s airpod case,1,0,52459104,unknown
166637391384907712,1666373913,2022-10-21T12:38:33,Keller “Lemon Man” White,63896632,Who’s shirt,1,0,52459104,unknown
166637385009155984,1666373850,2022-10-21T12:37:30,Keller “Lemon Man” White,63896632,Yes,0,1,52459104,unknown
166637377639885984,1666373776,2022-10-21T12:36:16,Keller “Lemon Man” White,63896632,Also who owns the football ,0,0,52459104,unknown
166637376350967712,1666373763,2022-10-21T12:36:03,Keller “Lemon Man” White,63896632,Who’s jacket?,1,0,52459104,unknown
166637372106357712,1666373721,2022-10-21T12:35:21,GroupMe,63896632,This message has been deleted,0,0,52459104,unknown
166631936578869564,1666319365,2022-10-20T21:29:25,Keller “Lemon Man” White,63896632,But he spilt half of it,0,0,52459104,unknown
166629533857953602,1666295338,2022-10-20T14:48:58,Keller “Lemon Man” White,63896632,If anyone has a speaker can you bring it ours is dead,0,1,52459104,unknown
166629226964353602,1666292269,2022-10-20T13:57:49,Keller “Lemon Man” White,63896632,"We have a shorter tailgate today so we need to get drunk even faster than usual, which is why we’re doing 🚨🚨🚨SHOTGUN TIME TRIALS 🚨🚨🚨. Winner gets an entire case of redbull.",0,4,52459104,unknown
166542592290715287,1665425922,2022-10-10T13:18:42,Keller “Lemon Man” White,63896632,I forgot about that thank you,1,1,52459104,unknown
166527293484842540,1665272934,2022-10-08T18:48:54,Keller “Lemon Man” White,63896632,Nvm found them,0,0,52459104,unknown
166527241168018215,1665272411,2022-10-08T18:40:11,Keller “Lemon Man” White,63896632,Does anyone have my car keys? They are not with me right now,0,0,52459104,unknown
